{
  "id": "WHPRS-GAM-004",
  "slug": "modo-energia-gaming",
  "name": "Ajustar el modo de energía para gaming",
  "shortName": "Modo de energía",
  "category": "Optimización",
  "subcategory": "Gaming",
  "phase": "Optimización",
  "risk": 2,
  "estimatedTime": "3 minutos",
  "description": "Configura el modo de energía de Windows para priorizar rendimiento cuando el equipo está conectado a corriente.",
  "goal": "Evitar límites de rendimiento provocados por un modo de ahorro de energía.",
  "whenUse": [
    "Cuando el portátil rinde menos conectado o con batería",
    "Cuando CPU y GPU reducen frecuencia",
    "Cuando el juego presenta caídas de FPS sostenidas"
  ],
  "whenNotUse": [
    "Cuando el equipo se sobrecalienta",
    "Cuando se juega únicamente con batería",
    "Cuando la refrigeración no funciona correctamente"
  ],
  "requirements": [
    "Windows 10 o Windows 11",
    "Equipo conectado a corriente",
    "Temperaturas normales"
  ],
  "commands": [
    {
      "command": "ms-settings:powersleep",
      "requiresAdmin": false,
      "shell": "run",
      "purpose": "Abrir la configuración de energía."
    }
  ],
  "steps": [
    {
      "order": 1,
      "title": "Conectar el equipo",
      "instruction": "Conecta el equipo a una fuente de energía estable."
    },
    {
      "order": 2,
      "title": "Abrir Energía",
      "instruction": "Abre Configuración, Sistema, Energía y batería."
    },
    {
      "order": 3,
      "title": "Elegir mejor rendimiento",
      "instruction": "Selecciona Mejor rendimiento cuando el equipo esté conectado."
    },
    {
      "order": 4,
      "title": "Vigilar temperatura",
      "instruction": "Prueba el juego y detente si la temperatura o el ruido aumentan de forma anormal."
    }
  ],
  "validation": [
    {
      "type": "manual",
      "expected": "El juego mantiene frecuencias y FPS más estables sin sobrecalentamiento."
    }
  ],
  "failureActions": [],
  "nextProcedures": [],
  "related": [
    "modo-juego",
    "dxdiag-gaming"
  ],
  "windows": [
    "Windows 10",
    "Windows 11"
  ],
  "status": "active",
  "version": "1.0.0"
}