{
  "id": "WHPRS-NET-005",
  "slug": "renovar-ip",
  "name": "Liberar y renovar la dirección IP",
  "shortName": "Release / Renew",
  "category": "Red",
  "subcategory": "Configuración IP",
  "phase": "Red",
  "risk": 2,
  "estimatedTime": "3 a 5 minutos",
  "description": "Solicita una nueva configuración IP al router o servidor DHCP de la red.",
  "goal": "Corregir una dirección IP inválida o una concesión DHCP defectuosa.",
  "whenUse": [
    "Cuando aparece una dirección 169.254.x.x",
    "Cuando el equipo está conectado pero sin Internet",
    "Cuando otros dispositivos sí tienen conexión"
  ],
  "whenNotUse": [
    "Cuando se utiliza una dirección IP estática configurada manualmente",
    "Cuando el problema afecta a todos los dispositivos"
  ],
  "requirements": [
    "CMD o PowerShell como administrador",
    "Windows 10 o Windows 11",
    "Red con DHCP activo"
  ],
  "commands": [
    {
      "command": "ipconfig /release && ipconfig /renew",
      "requiresAdmin": true,
      "shell": "cmd",
      "purpose": "Liberar la concesión actual y solicitar una nueva dirección IP."
    }
  ],
  "steps": [
    {
      "order": 1,
      "title": "Abrir la terminal como administrador",
      "instruction": "Abre CMD o PowerShell con permisos de administrador."
    },
    {
      "order": 2,
      "title": "Liberar la dirección",
      "instruction": "Ejecuta ipconfig /release."
    },
    {
      "order": 3,
      "title": "Renovar la dirección",
      "instruction": "Ejecuta ipconfig /renew."
    },
    {
      "order": 4,
      "title": "Confirmar la configuración",
      "instruction": "Ejecuta ipconfig y comprueba que exista una dirección IPv4 válida."
    }
  ],
  "validation": [
    {
      "type": "state",
      "expected": "El adaptador recibe una dirección IPv4 válida y recupera conectividad."
    }
  ],
  "failureActions": [],
  "nextProcedures": [],
  "related": [
    "ipconfig",
    "flushdns",
    "ping"
  ],
  "windows": [
    "Windows 10",
    "Windows 11"
  ],
  "status": "active",
  "version": "1.0.0"
}