{
  "id": "WHPRS-DIA-004",
  "slug": "comprobar-disco-arranque",
  "name": "Comprobar si el disco de Windows es detectado",
  "shortName": "Comprobar disco",
  "category": "Diagnóstico",
  "subcategory": "Hardware",
  "phase": "Diagnóstico",
  "risk": 1,
  "estimatedTime": "5 a 10 minutos",
  "description": "Comprueba si BIOS, UEFI o el entorno de recuperación detectan la unidad donde está instalado Windows.",
  "goal": "Separar un fallo físico de almacenamiento de un problema lógico de arranque.",
  "whenUse": [
    "Aparece No boot device",
    "El equipo entra directamente en BIOS o UEFI"
  ],
  "whenNotUse": [
    "Windows inicia normalmente",
    "No se tiene experiencia para abrir el equipo"
  ],
  "requirements": [
    "Acceso a BIOS, UEFI o recuperación",
    "No cambiar opciones desconocidas"
  ],
  "commands": [
    {
      "command": "diskpart",
      "requiresAdmin": true,
      "shell": "cmd",
      "purpose": "Abrir DiskPart desde recuperación."
    },
    {
      "command": "list disk",
      "requiresAdmin": true,
      "shell": "cmd",
      "purpose": "Mostrar discos detectados."
    }
  ],
  "steps": [
    {
      "order": 1,
      "title": "Entrar en BIOS o UEFI",
      "instruction": "Comprueba si aparece la unidad de almacenamiento."
    },
    {
      "order": 2,
      "title": "Abrir Símbolo del sistema",
      "instruction": "Desde Recuperación, abre Símbolo del sistema."
    },
    {
      "order": 3,
      "title": "Listar discos",
      "instruction": "Ejecuta diskpart y luego list disk.",
      "warning": "No ejecutes clean, format ni delete."
    }
  ],
  "validation": [
    {
      "type": "manual",
      "expected": "La unidad de Windows aparece en BIOS, UEFI o DiskPart."
    }
  ],
  "failureActions": [],
  "nextProcedures": [],
  "related": [
    "reparacion-inicio",
    "chkdsk"
  ],
  "windows": [
    "Windows 10",
    "Windows 11",
    "Windows Recovery Environment"
  ],
  "status": "active",
  "version": "1.0.0"
}