{
  "id": "WHPRS-SEC-004",
  "slug": "defender-offline-scan",
  "name": "Ejecutar el examen sin conexión de Microsoft Defender",
  "shortName": "Examen sin conexión",
  "category": "Seguridad",
  "subcategory": "Análisis avanzado",
  "phase": "Seguridad",
  "risk": 2,
  "estimatedTime": "15 a 30 minutos",
  "description": "Reinicia el equipo y analiza Windows antes de que el sistema operativo se cargue completamente.",
  "goal": "Detectar malware persistente que puede ocultarse o protegerse mientras Windows está funcionando.",
  "whenUse": [
    "Cuando la amenaza reaparece después de eliminarla",
    "Cuando Defender recomienda un examen sin conexión",
    "Cuando existen síntomas graves de malware persistente"
  ],
  "whenNotUse": [
    "Cuando hay trabajo sin guardar",
    "Cuando el equipo no puede reiniciarse de forma segura",
    "Cuando se utiliza cifrado o configuración empresarial que requiere autorización"
  ],
  "requirements": [
    "Guardar todo el trabajo",
    "Microsoft Defender activo",
    "Equipo conectado a energía"
  ],
  "commands": [
    {
      "command": "Start-MpWDOScan",
      "requiresAdmin": true,
      "shell": "powershell",
      "purpose": "Programar e iniciar el examen sin conexión de Microsoft Defender."
    }
  ],
  "steps": [
    {
      "order": 1,
      "title": "Guardar y cerrar",
      "instruction": "Guarda todos los archivos y cierra las aplicaciones."
    },
    {
      "order": 2,
      "title": "Abrir PowerShell como administrador",
      "instruction": "Abre PowerShell con permisos de administrador."
    },
    {
      "order": 3,
      "title": "Iniciar el examen sin conexión",
      "instruction": "Ejecuta Start-MpWDOScan.",
      "warning": "El equipo se reiniciará automáticamente."
    },
    {
      "order": 4,
      "title": "Revisar el resultado",
      "instruction": "Después de volver a Windows, abre Historial de protección."
    }
  ],
  "validation": [
    {
      "type": "restart",
      "expected": "Windows vuelve a iniciar y el Historial de protección no muestra amenazas activas."
    }
  ],
  "failureActions": [],
  "nextProcedures": [],
  "related": [
    "defender-full-scan",
    "historial-proteccion-defender"
  ],
  "windows": [
    "Windows 10",
    "Windows 11"
  ],
  "status": "active",
  "version": "1.0.0"
}