{
  "id": "WHPRS-GAM-001",
  "slug": "dxdiag-gaming",
  "name": "Revisar hardware y controladores gráficos con DxDiag",
  "shortName": "DxDiag",
  "category": "Diagnóstico",
  "subcategory": "Gaming",
  "phase": "Diagnóstico",
  "risk": 1,
  "estimatedTime": "5 minutos",
  "description": "Muestra información de DirectX, GPU, memoria gráfica, controladores y posibles errores relacionados con juegos.",
  "goal": "Confirmar la GPU detectada, la versión del controlador y el estado básico de DirectX antes de optimizar.",
  "whenUse": [
    "Cuando los juegos tienen FPS bajos",
    "Cuando un juego utiliza la GPU incorrecta",
    "Cuando aparecen errores de DirectX"
  ],
  "whenNotUse": [
    "Cuando Windows no inicia",
    "Cuando la GPU no aparece físicamente en el sistema"
  ],
  "requirements": [
    "Windows 10 o Windows 11",
    "Acceso al escritorio"
  ],
  "commands": [
    {
      "command": "dxdiag",
      "requiresAdmin": false,
      "shell": "run",
      "purpose": "Abrir la Herramienta de diagnóstico de DirectX."
    }
  ],
  "steps": [
    {
      "order": 1,
      "title": "Abrir DxDiag",
      "instruction": "Presiona Win + R, escribe dxdiag y presiona Enter."
    },
    {
      "order": 2,
      "title": "Revisar Pantalla",
      "instruction": "Confirma el nombre de la GPU, memoria aproximada y fecha del controlador."
    },
    {
      "order": 3,
      "title": "Comprobar problemas",
      "instruction": "Revisa el cuadro Notas para detectar errores reportados por DirectX."
    }
  ],
  "validation": [
    {
      "type": "manual",
      "expected": "DxDiag detecta correctamente la GPU y no muestra problemas críticos."
    }
  ],
  "failureActions": [],
  "nextProcedures": [],
  "related": [
    "gpu-alto-rendimiento",
    "modo-juego"
  ],
  "windows": [
    "Windows 10",
    "Windows 11"
  ],
  "status": "active",
  "version": "1.0.0"
}