{
  "id": "WHPRS-OPT-001",
  "slug": "programas-inicio",
  "name": "Revisar programas de inicio de Windows",
  "shortName": "Programas de inicio",
  "category": "Optimización",
  "subcategory": "Inicio",
  "phase": "Optimización",
  "risk": 2,
  "estimatedTime": "5 a 10 minutos",
  "description": "Permite deshabilitar aplicaciones no esenciales que se ejecutan automáticamente al iniciar Windows.",
  "goal": "Reducir el consumo de memoria y mejorar el tiempo de inicio sin desactivar componentes críticos.",
  "whenUse": [
    "Cuando la memoria está elevada después de iniciar sesión",
    "Cuando el arranque es lento",
    "Cuando hay muchas aplicaciones en segundo plano"
  ],
  "whenNotUse": [
    "Cuando no se conoce la función de una aplicación",
    "Cuando se trata de antivirus, controladores o utilidades del fabricante necesarias"
  ],
  "requirements": [
    "Windows 10 o Windows 11",
    "Identificar aplicaciones no esenciales"
  ],
  "commands": [
    {
      "command": "taskmgr",
      "requiresAdmin": false,
      "shell": "run",
      "purpose": "Abrir el Administrador de tareas y la sección Aplicaciones de inicio."
    }
  ],
  "steps": [
    {
      "order": 1,
      "title": "Abrir Aplicaciones de inicio",
      "instruction": "Abre el Administrador de tareas y entra en Aplicaciones de inicio."
    },
    {
      "order": 2,
      "title": "Ordenar por impacto",
      "instruction": "Ordena por Impacto de inicio."
    },
    {
      "order": 3,
      "title": "Deshabilitar solo lo innecesario",
      "instruction": "Deshabilita aplicaciones conocidas que no necesitas al encender el equipo.",
      "warning": "No deshabilites antivirus, audio, gráficos, touchpad ni utilidades esenciales."
    }
  ],
  "validation": [
    {
      "type": "restart",
      "expected": "Después de reiniciar, Windows inicia correctamente y utiliza menos memoria."
    }
  ],
  "failureActions": [],
  "nextProcedures": [],
  "related": [
    "administrador-tareas"
  ],
  "windows": [
    "Windows 10",
    "Windows 11"
  ],
  "status": "active",
  "version": "1.0.0"
}