{
  "id": "WHPRS-DIA-003",
  "slug": "monitor-recursos",
  "name": "Diagnóstico avanzado con Monitor de recursos",
  "shortName": "Resource Monitor",
  "category": "Diagnóstico",
  "subcategory": "Rendimiento",
  "phase": "Diagnóstico",
  "risk": 1,
  "estimatedTime": "5 a 10 minutos",
  "description": "Muestra el consumo detallado de CPU, memoria, disco y red por proceso y servicio.",
  "goal": "Confirmar qué proceso, servicio o archivo provoca un uso elevado de recursos.",
  "whenUse": [
    "Cuando el Administrador de tareas no ofrece suficiente detalle",
    "Cuando CPU, RAM o disco permanecen elevados"
  ],
  "whenNotUse": [
    "Cuando Windows no inicia",
    "Cuando el sistema no responde a ninguna entrada"
  ],
  "requirements": [
    "Windows 10 o Windows 11",
    "Acceso al escritorio"
  ],
  "commands": [
    {
      "command": "resmon",
      "requiresAdmin": false,
      "shell": "run",
      "purpose": "Abrir el Monitor de recursos."
    }
  ],
  "steps": [
    {
      "order": 1,
      "title": "Abrir Ejecutar",
      "instruction": "Presiona Win + R."
    },
    {
      "order": 2,
      "title": "Abrir Monitor de recursos",
      "instruction": "Escribe resmon y presiona Enter."
    },
    {
      "order": 3,
      "title": "Revisar el recurso elevado",
      "instruction": "Abre la pestaña CPU, Memoria o Disco y ordena los procesos por actividad."
    }
  ],
  "validation": [
    {
      "type": "manual",
      "expected": "Se confirmó el proceso o servicio responsable del consumo elevado."
    }
  ],
  "failureActions": [],
  "nextProcedures": [],
  "related": [
    "administrador-tareas",
    "historial-confiabilidad"
  ],
  "windows": [
    "Windows 10",
    "Windows 11"
  ],
  "status": "active",
  "version": "1.0.0"
}