{
  "id": "WHPRS-REC-002",
  "slug": "modo-seguro",
  "name": "Iniciar Windows en Modo seguro",
  "shortName": "Modo seguro",
  "category": "Diagnóstico",
  "subcategory": "Arranque",
  "phase": "Diagnóstico",
  "risk": 1,
  "estimatedTime": "5 a 15 minutos",
  "description": "Inicia Windows con controladores y servicios mínimos para aislar conflictos de software o controladores.",
  "goal": "Confirmar si el fallo desaparece al cargar solo componentes esenciales.",
  "whenUse": [
    "Windows se bloquea después de iniciar",
    "Se instaló software o controlador reciente"
  ],
  "whenNotUse": [
    "El disco no es detectado",
    "No hay acceso a recuperación"
  ],
  "requirements": [
    "Acceso al entorno de recuperación",
    "Contraseña de la cuenta"
  ],
  "commands": [
    {
      "command": "shutdown /r /o /t 0",
      "requiresAdmin": true,
      "shell": "cmd",
      "purpose": "Abrir opciones avanzadas."
    }
  ],
  "steps": [
    {
      "order": 1,
      "title": "Abrir Configuración de inicio",
      "instruction": "En Opciones avanzadas, selecciona Configuración de inicio y Reiniciar."
    },
    {
      "order": 2,
      "title": "Elegir Modo seguro",
      "instruction": "Presiona 4 para Modo seguro o 5 para Modo seguro con red."
    },
    {
      "order": 3,
      "title": "Comprobar estabilidad",
      "instruction": "Inicia sesión y observa si Windows funciona sin bloqueos."
    }
  ],
  "validation": [
    {
      "type": "manual",
      "expected": "Windows inicia en Modo seguro y permite retirar el cambio problemático."
    }
  ],
  "failureActions": [],
  "nextProcedures": [],
  "related": [
    "desinstalar-actualizacion",
    "restaurar-sistema"
  ],
  "windows": [
    "Windows 10",
    "Windows 11",
    "Windows Recovery Environment"
  ],
  "status": "active",
  "version": "1.0.0"
}