{
  "id": "WHPRS-NET-002",
  "slug": "ping",
  "name": "Comprobar conectividad con ping",
  "shortName": "ping",
  "category": "Red",
  "subcategory": "Conectividad",
  "phase": "Diagnóstico",
  "risk": 1,
  "estimatedTime": "3 a 5 minutos",
  "description": "Comprueba si el equipo puede comunicarse con la puerta de enlace y con destinos externos.",
  "goal": "Diferenciar un problema local, de Internet o de resolución DNS.",
  "whenUse": [
    "Cuando no hay acceso a Internet",
    "Cuando la conexión es intermitente",
    "Cuando se necesita medir pérdida de paquetes"
  ],
  "whenNotUse": [
    "Cuando el adaptador está deshabilitado",
    "Cuando no existe una dirección IP válida"
  ],
  "requirements": [
    "Windows 10 o Windows 11",
    "CMD o PowerShell",
    "Conocer la puerta de enlace cuando se prueba la red local"
  ],
  "commands": [
    {
      "command": "ping 1.1.1.1",
      "requiresAdmin": false,
      "shell": "cmd",
      "purpose": "Comprobar conectividad externa sin depender de DNS."
    }
  ],
  "steps": [
    {
      "order": 1,
      "title": "Abrir la terminal",
      "instruction": "Abre CMD o PowerShell."
    },
    {
      "order": 2,
      "title": "Probar una dirección externa",
      "instruction": "Ejecuta ping 1.1.1.1."
    },
    {
      "order": 3,
      "title": "Revisar el resultado",
      "instruction": "Comprueba si hay respuestas, pérdida de paquetes o tiempos de espera."
    }
  ],
  "validation": [
    {
      "type": "output",
      "expected": "El comando recibe respuestas sin pérdida significativa de paquetes."
    }
  ],
  "failureActions": [],
  "nextProcedures": [],
  "related": [
    "ipconfig",
    "pathping",
    "nslookup"
  ],
  "windows": [
    "Windows 10",
    "Windows 11"
  ],
  "status": "active",
  "version": "1.0.0"
}