{
  "id": "WHPRS-REP-005",
  "slug": "revertir-controlador",
  "name": "Revertir un controlador que causa pantallas azules",
  "shortName": "Revertir controlador",
  "category": "Reparación",
  "subcategory": "Controladores",
  "phase": "Reparación",
  "risk": 3,
  "estimatedTime": "10 a 20 minutos",
  "description": "Vuelve a la versión anterior de un controlador cuando las pantallas azules comenzaron después de una actualización.",
  "goal": "Deshacer un controlador inestable sin usar paquetes desconocidos ni herramientas automáticas de terceros.",
  "whenUse": [
    "Cuando el fallo comenzó justo después de actualizar un controlador",
    "Cuando el Historial de confiabilidad señala un controlador",
    "Cuando Modo seguro funciona correctamente"
  ],
  "whenNotUse": [
    "Cuando no existe relación con un controlador",
    "Cuando no está disponible la opción Revertir controlador",
    "Cuando se desconoce qué dispositivo está involucrado"
  ],
  "requirements": [
    "Acceso a Windows o Modo seguro",
    "Punto de restauración recomendado"
  ],
  "commands": [
    {
      "command": "devmgmt.msc",
      "requiresAdmin": true,
      "shell": "run",
      "purpose": "Abrir el Administrador de dispositivos."
    }
  ],
  "steps": [
    {
      "order": 1,
      "title": "Abrir Administrador de dispositivos",
      "instruction": "Presiona Win + R, escribe devmgmt.msc y presiona Enter."
    },
    {
      "order": 2,
      "title": "Abrir el dispositivo relacionado",
      "instruction": "Busca el dispositivo o controlador identificado en el diagnóstico."
    },
    {
      "order": 3,
      "title": "Revertir el controlador",
      "instruction": "En Propiedades, abre Controlador y selecciona Revertir al controlador anterior.",
      "warning": "No desinstales dispositivos al azar."
    },
    {
      "order": 4,
      "title": "Reiniciar y probar",
      "instruction": "Reinicia y comprueba si vuelve a aparecer la pantalla azul."
    }
  ],
  "validation": [
    {
      "type": "restart",
      "expected": "Windows permanece estable después de volver al controlador anterior."
    }
  ],
  "failureActions": [],
  "nextProcedures": [],
  "related": [
    "modo-seguro",
    "restaurar-sistema",
    "historial-confiabilidad-bsod"
  ],
  "windows": [
    "Windows 10",
    "Windows 11"
  ],
  "status": "active",
  "version": "1.0.0"
}