{
  "id": "WHPRS-REC-004",
  "slug": "restaurar-sistema-recovery",
  "name": "Restaurar Windows desde un punto de restauración",
  "shortName": "Restaurar sistema",
  "category": "Reparación",
  "subcategory": "Recuperación",
  "phase": "Reparación",
  "risk": 3,
  "estimatedTime": "20 a 60 minutos",
  "description": "Revierte archivos del sistema, controladores y aplicaciones a un punto anterior sin borrar documentos personales.",
  "goal": "Deshacer un cambio reciente que impide el arranque.",
  "whenUse": [
    "El fallo comenzó después de software o controladores",
    "Existe un punto anterior al problema"
  ],
  "whenNotUse": [
    "No existe punto de restauración",
    "El disco presenta fallos físicos"
  ],
  "requirements": [
    "Acceso a recuperación",
    "Punto de restauración disponible",
    "Equipo conectado a energía"
  ],
  "commands": [
    {
      "command": "rstrui.exe",
      "requiresAdmin": true,
      "shell": "run",
      "purpose": "Abrir Restaurar sistema cuando Windows todavía inicia."
    }
  ],
  "steps": [
    {
      "order": 1,
      "title": "Abrir Restaurar sistema",
      "instruction": "En Opciones avanzadas, selecciona Restaurar sistema."
    },
    {
      "order": 2,
      "title": "Elegir un punto anterior",
      "instruction": "Selecciona un punto creado antes del fallo."
    },
    {
      "order": 3,
      "title": "Revisar programas afectados",
      "instruction": "Consulta los programas y controladores que serán revertidos."
    },
    {
      "order": 4,
      "title": "Confirmar",
      "instruction": "Inicia la restauración y no apagues el equipo."
    }
  ],
  "validation": [
    {
      "type": "restart",
      "expected": "Windows inicia y el problema ya no aparece."
    }
  ],
  "failureActions": [],
  "nextProcedures": [],
  "related": [
    "reparacion-inicio",
    "modo-seguro"
  ],
  "windows": [
    "Windows 10",
    "Windows 11",
    "Windows Recovery Environment"
  ],
  "status": "active",
  "version": "1.0.0"
}