{
  "id": "WHPRS-NET-003",
  "slug": "nslookup",
  "name": "Comprobar la resolución DNS con nslookup",
  "shortName": "nslookup",
  "category": "Red",
  "subcategory": "DNS",
  "phase": "Diagnóstico",
  "risk": 1,
  "estimatedTime": "3 minutos",
  "description": "Comprueba si los servidores DNS pueden convertir nombres de dominio en direcciones IP.",
  "goal": "Confirmar si la conexión funciona pero falla la resolución de nombres.",
  "whenUse": [
    "Cuando ping a una IP funciona pero las páginas no abren",
    "Cuando aparece un error de DNS",
    "Cuando algunos dominios no cargan"
  ],
  "whenNotUse": [
    "Cuando no existe conectividad con ninguna dirección IP",
    "Cuando el adaptador no tiene configuración válida"
  ],
  "requirements": [
    "Windows 10 o Windows 11",
    "CMD o PowerShell"
  ],
  "commands": [
    {
      "command": "nslookup microsoft.com",
      "requiresAdmin": false,
      "shell": "cmd",
      "purpose": "Comprobar si DNS resuelve un dominio conocido."
    }
  ],
  "steps": [
    {
      "order": 1,
      "title": "Abrir la terminal",
      "instruction": "Abre CMD o PowerShell."
    },
    {
      "order": 2,
      "title": "Ejecutar nslookup",
      "instruction": "Escribe nslookup microsoft.com y presiona Enter."
    },
    {
      "order": 3,
      "title": "Comprobar la respuesta",
      "instruction": "Revisa si se devuelve una o más direcciones IP."
    }
  ],
  "validation": [
    {
      "type": "output",
      "expected": "El servidor DNS devuelve una dirección IP para microsoft.com."
    }
  ],
  "failureActions": [],
  "nextProcedures": [],
  "related": [
    "flushdns",
    "ipconfig",
    "ping"
  ],
  "windows": [
    "Windows 10",
    "Windows 11"
  ],
  "status": "active",
  "version": "1.0.0"
}